xxxxxxxxxxxxxxxxxxxxxxxxxxxxxxxxxxxxxxxxxxxxxxxxxxxxxxxxxxx
                 Starting Crush
                 Version: TestU01 1.2.3
xxxxxxxxxxxxxxxxxxxxxxxxxxxxxxxxxxxxxxxxxxxxxxxxxxxxxxxxxxx


***********************************************************
Test smarsa_SerialOver calling smultin_MultinomialOver

***********************************************************
HOST = DESKTOP-4M1PN36, Linux

pipe_gen


smultin_MultinomialOver test:
-----------------------------------------------
   N =  1,  n = 500000000,  r =  0,   d = 4096,   t =  2,
       Sparse =  FALSE

       GenerCell = smultin_GenerCellSerial
       Number of cells = d^t =           16777216
       Expected number per cell =   29.802322
       Hashing =  FALSE

   For Delta > -1, we use the ChiSquare approximation
   Correction factor of the ChiSquare: 
       Delta =     1,    Mu =     0.01677312,    Sigma =          1

-----------------------------------------------
Test Results for Delta =   1.0000

Number of degrees of freedom          : 16773120
Value of the statistic                : 1.68e+7
p-value of test                       :    0.44


-----------------------------------------------
CPU time used                    :  00:04:34.32

Generator state:




***********************************************************
Test smarsa_SerialOver calling smultin_MultinomialOver

***********************************************************
HOST = DESKTOP-4M1PN36, Linux

pipe_gen


smultin_MultinomialOver test:
-----------------------------------------------
   N =  1,  n = 300000000,  r =  0,   d =   64,   t =  4,
       Sparse =  FALSE

       GenerCell = smultin_GenerCellSerial
       Number of cells = d^t =           16777216
       Expected number per cell =   17.881393
       Hashing =  FALSE

   For Delta > -1, we use the ChiSquare approximation
   Correction factor of the ChiSquare: 
       Delta =     1,    Mu =    0.027525119,    Sigma =          1

-----------------------------------------------
Test Results for Delta =   1.0000

Number of degrees of freedom          : 16515072
Value of the statistic                : 1.65e+7
p-value of test                       :    0.40


-----------------------------------------------
CPU time used                    :  00:02:41.98

Generator state:




***********************************************************
Test smarsa_CollisionOver calling smultin_MultinomialOver

***********************************************************
HOST = DESKTOP-4M1PN36, Linux

pipe_gen


smultin_MultinomialOver test:
-----------------------------------------------
   N = 10,  n = 10000000,  r =  0,   d = 1048576,   t =  2,
       Sparse =   TRUE

       GenerCell = smultin_GenerCellSerial
       Number of cells = d^t =      1099511627776
       Expected number per cell =  1 /  109951.16
       EColl = n^2 / (2k) =  45.47473509
       Hashing =   TRUE

       Collision test

       CollisionOver:   density = n / k =  1 /  109951.16
       Expected number of collisions = Mu =      45.47


-----------------------------------------------
Results of CollisionOver test:

POISSON approximation                 :
Expected number of collisions = N*Mu  :      454.75
Observed number of collisions         :      452
p-value of test                       :    0.54

-----------------------------
Total number of cells containing j balls

  j =  0                              :   10995016278212
  j =  1                              :         99999096
  j =  2                              :              452
  j =  3                              :                0
  j =  4                              :                0
  j =  5                              :                0

-----------------------------------------------
CPU time used                    :  00:01:10.97

Generator state:




***********************************************************
Test smarsa_CollisionOver calling smultin_MultinomialOver

***********************************************************
HOST = DESKTOP-4M1PN36, Linux

pipe_gen


smultin_MultinomialOver test:
-----------------------------------------------
   N = 10,  n = 10000000,  r = 10,   d = 1048576,   t =  2,
       Sparse =   TRUE

       GenerCell = smultin_GenerCellSerial
       Number of cells = d^t =      1099511627776
       Expected number per cell =  1 /  109951.16
       EColl = n^2 / (2k) =  45.47473509
       Hashing =   TRUE

       Collision test

       CollisionOver:   density = n / k =  1 /  109951.16
       Expected number of collisions = Mu =      45.47


-----------------------------------------------
Results of CollisionOver test:

POISSON approximation                 :
Expected number of collisions = N*Mu  :      454.75
Observed number of collisions         :      478
p-value of test                       :    0.14

-----------------------------
Total number of cells containing j balls

  j =  0                              :   10995016278238
  j =  1                              :         99999044
  j =  2                              :              478
  j =  3                              :                0
  j =  4                              :                0
  j =  5                              :                0

-----------------------------------------------
CPU time used                    :  00:01:12.08

Generator state:




***********************************************************
Test smarsa_CollisionOver calling smultin_MultinomialOver

***********************************************************
HOST = DESKTOP-4M1PN36, Linux

pipe_gen


smultin_MultinomialOver test:
-----------------------------------------------
   N = 10,  n = 10000000,  r =  0,   d = 1024,   t =  4,
       Sparse =   TRUE

       GenerCell = smultin_GenerCellSerial
       Number of cells = d^t =      1099511627776
       Expected number per cell =  1 /  109951.16
       EColl = n^2 / (2k) =  45.47473509
       Hashing =   TRUE

       Collision test

       CollisionOver:   density = n / k =  1 /  109951.16
       Expected number of collisions = Mu =      45.47


-----------------------------------------------
Results of CollisionOver test:

POISSON approximation                 :
Expected number of collisions = N*Mu  :      454.75
Observed number of collisions         :      463
p-value of test                       :    0.36

-----------------------------
Total number of cells containing j balls

  j =  0                              :   10995016278223
  j =  1                              :         99999074
  j =  2                              :              463
  j =  3                              :                0
  j =  4                              :                0
  j =  5                              :                0

-----------------------------------------------
CPU time used                    :  00:01:22.13

Generator state:




***********************************************************
Test smarsa_CollisionOver calling smultin_MultinomialOver

***********************************************************
HOST = DESKTOP-4M1PN36, Linux

pipe_gen


smultin_MultinomialOver test:
-----------------------------------------------
   N = 10,  n = 10000000,  r = 20,   d = 1024,   t =  4,
       Sparse =   TRUE

       GenerCell = smultin_GenerCellSerial
       Number of cells = d^t =      1099511627776
       Expected number per cell =  1 /  109951.16
       EColl = n^2 / (2k) =  45.47473509
       Hashing =   TRUE

       Collision test

       CollisionOver:   density = n / k =  1 /  109951.16
       Expected number of collisions = Mu =      45.47


-----------------------------------------------
Results of CollisionOver test:

POISSON approximation                 :
Expected number of collisions = N*Mu  :      454.75
Observed number of collisions         :      418
p-value of test                       :    0.96

-----------------------------
Total number of cells containing j balls

  j =  0                              :   10995016278178
  j =  1                              :         99999164
  j =  2                              :              418
  j =  3                              :                0
  j =  4                              :                0
  j =  5                              :                0

-----------------------------------------------
CPU time used                    :  00:01:22.52

Generator state:




***********************************************************
Test smarsa_CollisionOver calling smultin_MultinomialOver

***********************************************************
HOST = DESKTOP-4M1PN36, Linux

pipe_gen


smultin_MultinomialOver test:
-----------------------------------------------
   N = 10,  n = 10000000,  r =  0,   d =   32,   t =  8,
       Sparse =   TRUE

       GenerCell = smultin_GenerCellSerial
       Number of cells = d^t =      1099511627776
       Expected number per cell =  1 /  109951.16
       EColl = n^2 / (2k) =  45.47473509
       Hashing =   TRUE

       Collision test

       CollisionOver:   density = n / k =  1 /  109951.16
       Expected number of collisions = Mu =      45.47


-----------------------------------------------
Results of CollisionOver test:

POISSON approximation                 :
Expected number of collisions = N*Mu  :      454.75
Observed number of collisions         :      460
p-value of test                       :    0.41

-----------------------------
Total number of cells containing j balls

  j =  0                              :   10995016278220
  j =  1                              :         99999080
  j =  2                              :              460
  j =  3                              :                0
  j =  4                              :                0
  j =  5                              :                0

-----------------------------------------------
CPU time used                    :  00:01:22.44

Generator state:




***********************************************************
Test smarsa_CollisionOver calling smultin_MultinomialOver

***********************************************************
HOST = DESKTOP-4M1PN36, Linux

pipe_gen


smultin_MultinomialOver test:
-----------------------------------------------
   N = 10,  n = 10000000,  r = 25,   d =   32,   t =  8,
       Sparse =   TRUE

       GenerCell = smultin_GenerCellSerial
       Number of cells = d^t =      1099511627776
       Expected number per cell =  1 /  109951.16
       EColl = n^2 / (2k) =  45.47473509
       Hashing =   TRUE

       Collision test

       CollisionOver:   density = n / k =  1 /  109951.16
       Expected number of collisions = Mu =      45.47


-----------------------------------------------
Results of CollisionOver test:

POISSON approximation                 :
Expected number of collisions = N*Mu  :      454.75
Observed number of collisions         :      452
p-value of test                       :    0.54

-----------------------------
Total number of cells containing j balls

  j =  0                              :   10995016278212
  j =  1                              :         99999096
  j =  2                              :              452
  j =  3                              :                0
  j =  4                              :                0
  j =  5                              :                0

-----------------------------------------------
CPU time used                    :  00:01:21.37

Generator state:




***********************************************************
Test smarsa_CollisionOver calling smultin_MultinomialOver

***********************************************************
HOST = DESKTOP-4M1PN36, Linux

pipe_gen


smultin_MultinomialOver test:
-----------------------------------------------
   N = 10,  n = 10000000,  r =  0,   d =    4,   t = 20,
       Sparse =   TRUE

       GenerCell = smultin_GenerCellSerial
       Number of cells = d^t =      1099511627776
       Expected number per cell =  1 /  109951.16
       EColl = n^2 / (2k) =  45.47473509
       Hashing =   TRUE

       Collision test

       CollisionOver:   density = n / k =  1 /  109951.16
       Expected number of collisions = Mu =      45.47


-----------------------------------------------
Results of CollisionOver test:

POISSON approximation                 :
Expected number of collisions = N*Mu  :      454.74
Observed number of collisions         :      423
p-value of test                       :    0.93

-----------------------------
Total number of cells containing j balls

  j =  0                              :   10995016278183
  j =  1                              :         99999154
  j =  2                              :              423
  j =  3                              :                0
  j =  4                              :                0
  j =  5                              :                0

-----------------------------------------------
CPU time used                    :  00:01:21.75

Generator state:




***********************************************************
Test smarsa_CollisionOver calling smultin_MultinomialOver

***********************************************************
HOST = DESKTOP-4M1PN36, Linux

pipe_gen


smultin_MultinomialOver test:
-----------------------------------------------
   N = 10,  n = 10000000,  r = 28,   d =    4,   t = 20,
       Sparse =   TRUE

       GenerCell = smultin_GenerCellSerial
       Number of cells = d^t =      1099511627776
       Expected number per cell =  1 /  109951.16
       EColl = n^2 / (2k) =  45.47473509
       Hashing =   TRUE

       Collision test

       CollisionOver:   density = n / k =  1 /  109951.16
       Expected number of collisions = Mu =      45.47


-----------------------------------------------
Results of CollisionOver test:

POISSON approximation                 :
Expected number of collisions = N*Mu  :      454.74
Observed number of collisions         :      449
p-value of test                       :    0.59

-----------------------------
Total number of cells containing j balls

  j =  0                              :   10995016278209
  j =  1                              :         99999102
  j =  2                              :              449
  j =  3                              :                0
  j =  4                              :                0
  j =  5                              :                0

-----------------------------------------------
CPU time used                    :  00:01:28.19

Generator state:




***********************************************************
HOST = DESKTOP-4M1PN36, Linux

pipe_gen


smarsa_BirthdaySpacings test:
-----------------------------------------------
   N =  5,  n = 20000000,  r =  0,    d = 2147483648,    t = 2,    p = 1


      Number of cells = d^t = 4611686018427387904
      Lambda = Poisson mean =     433.6809


----------------------------------------------------
Total expected number = N*Lambda      :    2168.40
Total observed number                 :    2183
p-value of test                       :    0.38


-----------------------------------------------
CPU time used                    :  00:01:35.82

Generator state:




***********************************************************
HOST = DESKTOP-4M1PN36, Linux

pipe_gen


smarsa_BirthdaySpacings test:
-----------------------------------------------
   N =  5,  n = 20000000,  r =  0,    d = 2097152,    t = 3,    p = 1


      Number of cells = d^t = 9223372036854775808
      Lambda = Poisson mean =     216.8404


----------------------------------------------------
Total expected number = N*Lambda      :    1084.20
Total observed number                 :    1085
p-value of test                       :    0.49


-----------------------------------------------
CPU time used                    :  00:02:11.65

Generator state:




***********************************************************
HOST = DESKTOP-4M1PN36, Linux

pipe_gen


smarsa_BirthdaySpacings test:
-----------------------------------------------
   N =  5,  n = 20000000,  r =  0,    d = 65536,    t = 4,    p = 1


      Number of cells = d^t = 18446744073709551616
      Lambda = Poisson mean =     108.4202


----------------------------------------------------
Total expected number = N*Lambda      :     542.10
Total observed number                 :     545
p-value of test                       :    0.46


-----------------------------------------------
CPU time used                    :  00:02:45.45

Generator state:




***********************************************************
HOST = DESKTOP-4M1PN36, Linux

pipe_gen


smarsa_BirthdaySpacings test:
-----------------------------------------------
   N =  3,  n = 20000000,  r =  0,    d = 512,    t = 7,    p = 1


      Number of cells = d^t = 9223372036854775808
      Lambda = Poisson mean =     216.8404


----------------------------------------------------
Total expected number = N*Lambda      :     650.52
Total observed number                 :     611
p-value of test                       :    0.94


-----------------------------------------------
CPU time used                    :  00:03:15.11

Generator state:




***********************************************************
HOST = DESKTOP-4M1PN36, Linux

pipe_gen


smarsa_BirthdaySpacings test:
-----------------------------------------------
   N =  3,  n = 20000000,  r =  7,    d = 512,    t = 7,    p = 1


      Number of cells = d^t = 9223372036854775808
      Lambda = Poisson mean =     216.8404


----------------------------------------------------
Total expected number = N*Lambda      :     650.52
Total observed number                 :     690
p-value of test                       :    0.06


-----------------------------------------------
CPU time used                    :  00:03:00.25

Generator state:




***********************************************************
HOST = DESKTOP-4M1PN36, Linux

pipe_gen


smarsa_BirthdaySpacings test:
-----------------------------------------------
   N =  3,  n = 20000000,  r = 14,    d = 256,    t = 8,    p = 1


      Number of cells = d^t = 18446744073709551616
      Lambda = Poisson mean =     108.4202


----------------------------------------------------
Total expected number = N*Lambda      :     325.26
Total observed number                 :     312
p-value of test                       :    0.76


-----------------------------------------------
CPU time used                    :  00:03:26.36

Generator state:




***********************************************************
HOST = DESKTOP-4M1PN36, Linux

pipe_gen


smarsa_BirthdaySpacings test:
-----------------------------------------------
   N =  3,  n = 20000000,  r = 22,    d = 256,    t = 8,    p = 1


      Number of cells = d^t = 18446744073709551616
      Lambda = Poisson mean =     108.4202


----------------------------------------------------
Total expected number = N*Lambda      :     325.26
Total observed number                 :     308
p-value of test                       :    0.82


-----------------------------------------------
CPU time used                    :  00:03:20.55

Generator state:




***********************************************************
HOST = DESKTOP-4M1PN36, Linux

pipe_gen


snpair_ClosePairs test:
-----------------------------------------------
   N = 10,  n = 2000000,  r =  0,  t = 2,  p = 0,  m = 30,  Torus =  TRUE


---------------------------------------
Test based on the 2 nearest points (NP):

Stat. AD on the N values (NP)         :    0.69
p-value of test                       :    0.57


A2 test based on the spacings between the
   successive jump times of process Y_n(t):

A2 test on the values of A2 (m-NP)    :    1.54
p-value of test                       :    0.17

Test on the Nm values of W_{n,i}(mNP1):    0.48
p-value of test                       :    0.77

Test on the jump times of Y
   (superposition of Yn):

Expected number of jumps of Y = mN    :     300
Number of jumps of Y                  :     299
p-value of test                       :    0.51

Stat. AD (mNP2)                       :    0.76
p-value of test                       :    0.51

-----------------------------------------------
CPU time used                    :  00:00:23.07

Generator state:




***********************************************************
HOST = DESKTOP-4M1PN36, Linux

pipe_gen


snpair_ClosePairs test:
-----------------------------------------------
   N = 10,  n = 2000000,  r =  0,  t = 3,  p = 0,  m = 30,  Torus =  TRUE


---------------------------------------
Test based on the 2 nearest points (NP):

Stat. AD on the N values (NP)         :    1.64
p-value of test                       :    0.15


A2 test based on the spacings between the
   successive jump times of process Y_n(t):

A2 test on the values of A2 (m-NP)    :    0.51
p-value of test                       :    0.74

Test on the Nm values of W_{n,i}(mNP1):    0.82
p-value of test                       :    0.47

Test on the jump times of Y
   (superposition of Yn):

Expected number of jumps of Y = mN    :     300
Number of jumps of Y                  :     320
p-value of test                       :    0.13

Stat. AD (mNP2)                       :    0.54
p-value of test                       :    0.71

Stat. AD after spacings (mNP2-S)      :    0.46
p-value of test                       :    0.79

-----------------------------------------------
CPU time used                    :  00:00:35.30

Generator state:




***********************************************************
HOST = DESKTOP-4M1PN36, Linux

pipe_gen


snpair_ClosePairs test:
-----------------------------------------------
   N =  5,  n = 2000000,  r =  0,  t = 7,  p = 0,  m = 30,  Torus =  TRUE


---------------------------------------
Test based on the 2 nearest points (NP):

Stat. AD on the N values (NP)         :    1.84
p-value of test                       :    0.11


A2 test based on the spacings between the
   successive jump times of process Y_n(t):

A2 test on the values of A2 (m-NP)    :    0.74
p-value of test                       :    0.52

Test on the Nm values of W_{n,i}(mNP1):    1.19
p-value of test                       :    0.27

Test on the jump times of Y
   (superposition of Yn):

Expected number of jumps of Y = mN    :     150
Number of jumps of Y                  :     157
p-value of test                       :    0.29

Stat. AD (mNP2)                       :    1.28
p-value of test                       :    0.24

Stat. AD after spacings (mNP2-S)      :    0.78
p-value of test                       :    0.49

-----------------------------------------------
CPU time used                    :  00:00:45.88

Generator state:




***********************************************************
HOST = DESKTOP-4M1PN36, Linux

pipe_gen


snpair_ClosePairsBitMatch test:
-----------------------------------------------
   N =  4,  n = 4000000,  r =  0,  t = 2


-----------------------------------------------
Max of all bit distances              :   23.00
p-value of test                       :    0.11

-----------------------------------------------
CPU time used                    :  00:00:19.75

Generator state:




***********************************************************
HOST = DESKTOP-4M1PN36, Linux

pipe_gen


snpair_ClosePairsBitMatch test:
-----------------------------------------------
   N =  2,  n = 4000000,  r =  0,  t = 4


-----------------------------------------------
Max of all bit distances              :   11.00
p-value of test                       :    0.06

-----------------------------------------------
CPU time used                    :  00:00:20.73

Generator state:




***********************************************************
HOST = DESKTOP-4M1PN36, Linux

pipe_gen


sknuth_SimpPoker test:
-----------------------------------------------
   N =  1,  n = 40000000,  r =  0,   d =   16,   k =   16


-----------------------------------------------
Number of degrees of freedom          :   12
Chi-square statistic                  :   16.52
p-value of test                       :    0.17

-----------------------------------------------
CPU time used                    :  00:04:53.96

Generator state:




***********************************************************
HOST = DESKTOP-4M1PN36, Linux

pipe_gen


sknuth_SimpPoker test:
-----------------------------------------------
   N =  1,  n = 40000000,  r = 26,   d =   16,   k =   16


-----------------------------------------------
Number of degrees of freedom          :   12
Chi-square statistic                  :   43.92
p-value of test                       :  1.6e-5    *****

-----------------------------------------------
CPU time used                    :  00:04:12.40

Generator state:




***********************************************************
HOST = DESKTOP-4M1PN36, Linux

pipe_gen


sknuth_SimpPoker test:
-----------------------------------------------
   N =  1,  n = 10000000,  r =  0,   d =   64,   k =   64


-----------------------------------------------
Number of degrees of freedom          :   23
Chi-square statistic                  :   41.70
p-value of test                       :  9.8e-3

-----------------------------------------------
CPU time used                    :  00:03:58.15

Generator state:




***********************************************************
HOST = DESKTOP-4M1PN36, Linux

pipe_gen


sknuth_SimpPoker test:
-----------------------------------------------
   N =  1,  n = 10000000,  r = 24,   d =   64,   k =   64


-----------------------------------------------
Number of degrees of freedom          :   23
Chi-square statistic                  :   42.95
p-value of test                       :  7.0e-3

-----------------------------------------------
CPU time used                    :  00:03:46.73

Generator state:




***********************************************************
HOST = DESKTOP-4M1PN36, Linux

pipe_gen


sknuth_CouponCollector test:
-----------------------------------------------
   N =  1,  n = 40000000,  r =  0,   d =    4


-----------------------------------------------
Number of degrees of freedom          :   51
Chi-square statistic                  :   38.36
p-value of test                       :    0.90

-----------------------------------------------
CPU time used                    :  00:02:08.38

Generator state:




***********************************************************
HOST = DESKTOP-4M1PN36, Linux

pipe_gen


sknuth_CouponCollector test:
-----------------------------------------------
   N =  1,  n = 40000000,  r = 28,   d =    4


-----------------------------------------------
Number of degrees of freedom          :   51
Chi-square statistic                  :   55.73
p-value of test                       :    0.30

-----------------------------------------------
CPU time used                    :  00:02:05.90

Generator state:




***********************************************************
HOST = DESKTOP-4M1PN36, Linux

pipe_gen


sknuth_CouponCollector test:
-----------------------------------------------
   N =  1,  n = 10000000,  r =  0,   d =   16


-----------------------------------------------
Number of degrees of freedom          :   46
Chi-square statistic                  :   47.37
p-value of test                       :    0.42

-----------------------------------------------
CPU time used                    :  00:03:08.88

Generator state:




***********************************************************
HOST = DESKTOP-4M1PN36, Linux

pipe_gen


sknuth_CouponCollector test:
-----------------------------------------------
   N =  1,  n = 10000000,  r = 26,   d =   16


-----------------------------------------------
Number of degrees of freedom          :   46
Chi-square statistic                  :   71.73
p-value of test                       :  9.0e-3

-----------------------------------------------
CPU time used                    :  00:03:11.48

Generator state:




***********************************************************
HOST = DESKTOP-4M1PN36, Linux

pipe_gen


sknuth_Gap test:
-----------------------------------------------
   N =  1,  n = 100000000,  r =  0,   Alpha =        0,   Beta  =    0.125


-----------------------------------------------
Number of degrees of freedom          :  106
Chi-square statistic                  :  264.37
p-value of test                       : 1.6e-15    *****

-----------------------------------------------
CPU time used                    :  00:04:55.35

Generator state:




***********************************************************
HOST = DESKTOP-4M1PN36, Linux

pipe_gen


sknuth_Gap test:
-----------------------------------------------
   N =  1,  n = 100000000,  r = 27,   Alpha =        0,   Beta  =    0.125


-----------------------------------------------
Number of degrees of freedom          :  106
Chi-square statistic                  :  183.19
p-value of test                       :  4.8e-6    *****

-----------------------------------------------
CPU time used                    :  00:05:10.94

Generator state:




***********************************************************
HOST = DESKTOP-4M1PN36, Linux

pipe_gen


sknuth_Gap test:
-----------------------------------------------
   N =  1,  n = 5000000,  r =  0,   Alpha =        0,   Beta  = 0.00390625


-----------------------------------------------
Number of degrees of freedom          : 1936
Chi-square statistic                  : 6975.67
p-value of test                       :   eps      *****

-----------------------------------------------
CPU time used                    :  00:08:18.27

Generator state:




***********************************************************
HOST = DESKTOP-4M1PN36, Linux

pipe_gen


sknuth_Gap test:
-----------------------------------------------
   N =  1,  n = 5000000,  r = 22,   Alpha =        0,   Beta  = 0.00390625


-----------------------------------------------
Number of degrees of freedom          : 1936
Chi-square statistic                  : 7307.06
p-value of test                       :   eps      *****

-----------------------------------------------
CPU time used                    :  00:08:00.26

Generator state:




***********************************************************
HOST = DESKTOP-4M1PN36, Linux

pipe_gen


sknuth_Run test:
-----------------------------------------------
   N =  1,  n = 500000000,  r =  0,   Up =  TRUE


-----------------------------------------------
Number of degrees of freedom          :    6
Chi-square statistic                  :    4.93
p-value of test                       :    0.55

-----------------------------------------------
CPU time used                    :  00:03:17.68

Generator state:




***********************************************************
HOST = DESKTOP-4M1PN36, Linux

pipe_gen


sknuth_Run test:
-----------------------------------------------
   N =  1,  n = 500000000,  r = 15,   Up = FALSE


-----------------------------------------------
Number of degrees of freedom          :    6
Chi-square statistic                  :   13.54
p-value of test                       :    0.04

-----------------------------------------------
CPU time used                    :  00:03:06.02

Generator state:




***********************************************************
Test sknuth_Permutation calling smultin_Multinomial

***********************************************************
HOST = DESKTOP-4M1PN36, Linux

pipe_gen


smultin_Multinomial test:
-----------------------------------------------
   N =  1,  n = 50000000,  r =  0,   t = 10,
       Sparse =  FALSE

       GenerCell = smultin_GenerCellPermut
       Number of cells = t! =            3628800
       Expected number per cell =    13.77866
       Hashing =  FALSE

   For Delta > -1, we use the ChiSquare approximation
   Correction factor of the ChiSquare: 
       Delta =     1,    Mu =     0.03628799,    Sigma =          1

-----------------------------------------------
Test Results for Delta =   1.0000

Number of degrees of freedom          : 3628799
Value of the statistic                : 3.63e+6
p-value of test                       :    0.88


-----------------------------------------------
CPU time used                    :  00:03:20.96

Generator state:




***********************************************************
Test sknuth_Permutation calling smultin_Multinomial

***********************************************************
HOST = DESKTOP-4M1PN36, Linux

pipe_gen


smultin_Multinomial test:
-----------------------------------------------
   N =  1,  n = 50000000,  r = 15,   t = 10,
       Sparse =  FALSE

       GenerCell = smultin_GenerCellPermut
       Number of cells = t! =            3628800
       Expected number per cell =    13.77866
       Hashing =  FALSE

   For Delta > -1, we use the ChiSquare approximation
   Correction factor of the ChiSquare: 
       Delta =     1,    Mu =     0.03628799,    Sigma =          1

-----------------------------------------------
Test Results for Delta =   1.0000

Number of degrees of freedom          : 3628799
Value of the statistic                : 3.63e+6
p-value of test                       :    0.65


-----------------------------------------------
CPU time used                    :  00:03:45.17

Generator state:




***********************************************************
Test sknuth_CollisionPermut calling smultin_Multinomial

***********************************************************
HOST = DESKTOP-4M1PN36, Linux

pipe_gen


smultin_Multinomial test:
-----------------------------------------------
   N =  5,  n = 10000000,  r =  0,   t = 13,
       Sparse =   TRUE

       GenerCell = smultin_GenerCellPermut
       Number of cells = t! =         6227020800
       Expected number per cell =  1 /  622.70208
       EColl = n^2 / (2k) =  8029.521918
       Hashing =   TRUE

       Collision test,    Mu =      8025.2245,    Sigma =    89.5098

-----------------------------------------------
Test Results for Collisions

For the total number of collisions, we use
      the Poisson approximation:
Expected number of collisions = N*Mu  :    40126.12
Observed number of collisions         :    40190
p-value of test                       :    0.38


-----------------------------
Total number of cells containing j balls

  j =  0                              :      31085144190
  j =  1                              :         49919638
  j =  2                              :            40154
  j =  3                              :               18
  j =  4                              :                0
  j =  5                              :                0

-----------------------------------------------
CPU time used                    :  00:04:21.50

Generator state:




***********************************************************
Test sknuth_CollisionPermut calling smultin_Multinomial

***********************************************************
HOST = DESKTOP-4M1PN36, Linux

pipe_gen


smultin_Multinomial test:
-----------------------------------------------
   N =  5,  n = 10000000,  r = 15,   t = 13,
       Sparse =   TRUE

       GenerCell = smultin_GenerCellPermut
       Number of cells = t! =         6227020800
       Expected number per cell =  1 /  622.70208
       EColl = n^2 / (2k) =  8029.521918
       Hashing =   TRUE

       Collision test,    Mu =      8025.2245,    Sigma =    89.5098

-----------------------------------------------
Test Results for Collisions

For the total number of collisions, we use
      the Poisson approximation:
Expected number of collisions = N*Mu  :    40126.12
Observed number of collisions         :    40287
p-value of test                       :    0.21


-----------------------------
Total number of cells containing j balls

  j =  0                              :      31085144287
  j =  1                              :         49919449
  j =  2                              :            40241
  j =  3                              :               23
  j =  4                              :                0
  j =  5                              :                0

-----------------------------------------------
CPU time used                    :  00:04:58.85

Generator state:




***********************************************************
HOST = DESKTOP-4M1PN36, Linux

pipe_gen


sknuth_MaxOft test:
-----------------------------------------------
   N = 10,  n = 10000000,  r =  0,   d = 100000,   t =  5

      Number of categories = 100000
      Expected number per category  = 100.00


-----------------------------------------------
Test results for chi2 with 99999 degrees of freedom:

Kolmogorov-Smirnov+ statistic = D+    :   0.094
p-value of test                       :    0.79

Kolmogorov-Smirnov- statistic = D-    :    0.24
p-value of test                       :    0.29

Anderson-Darling statistic = A2       :    0.54
p-value of test                       :    0.70

Test on the sum of all N observations
Number of degrees of freedom          : 999990
Chi-square statistic                  : 1.00e+6
p-value of test                       :    0.34


-----------------------------------------------
Test results for Anderson-Darling:

Kolmogorov-Smirnov+ statistic = D+    :   0.080
p-value of test                       :    0.84

Kolmogorov-Smirnov- statistic = D-    :    0.24
p-value of test                       :    0.26

Anderson-Darling statistic = A2       :    0.58
p-value of test                       :    0.66


-----------------------------------------------
CPU time used                    :  00:03:43.68

Generator state:




***********************************************************
HOST = DESKTOP-4M1PN36, Linux

pipe_gen


sknuth_MaxOft test:
-----------------------------------------------
   N =  5,  n = 10000000,  r =  0,   d = 100000,   t = 10

      Number of categories = 100000
      Expected number per category  = 100.00


-----------------------------------------------
Test results for chi2 with 99999 degrees of freedom:

Kolmogorov-Smirnov+ statistic = D+    :   0.084
p-value of test                       :    0.88

Kolmogorov-Smirnov- statistic = D-    :    0.60
p-value of test                       :    0.02

Anderson-Darling statistic = A2       :    2.04
p-value of test                       :    0.09

Test on the sum of all N observations
Number of degrees of freedom          : 499995
Chi-square statistic                  : 5.02e+5
p-value of test                       :    0.06


-----------------------------------------------
Test results for Anderson-Darling:

Kolmogorov-Smirnov+ statistic = D+    :    0.12
p-value of test                       :    0.81

Kolmogorov-Smirnov- statistic = D-    :    0.33
p-value of test                       :    0.27

Anderson-Darling statistic = A2       :    0.53
p-value of test                       :    0.71


-----------------------------------------------
CPU time used                    :  00:03:28.90

Generator state:




***********************************************************
HOST = DESKTOP-4M1PN36, Linux

pipe_gen


sknuth_MaxOft test:
-----------------------------------------------
   N =  1,  n = 10000000,  r =  0,   d = 100000,   t = 20

      Number of categories = 100000
      Expected number per category  = 100.00


-----------------------------------------------
Number of degrees of freedom          : 99999
Chi-square statistic                  :99805.78
p-value of test                       :    0.67


-----------------------------------------------
Anderson-Darling statistic            :    0.32
p-value of test                       :    0.68


-----------------------------------------------
CPU time used                    :  00:01:34.67

Generator state:




***********************************************************
HOST = DESKTOP-4M1PN36, Linux

pipe_gen


sknuth_MaxOft test:
-----------------------------------------------
   N =  1,  n = 10000000,  r =  0,   d = 100000,   t = 30

      Number of categories = 100000
      Expected number per category  = 100.00


-----------------------------------------------
Number of degrees of freedom          : 99999
Chi-square statistic                  :99686.98
p-value of test                       :    0.76


-----------------------------------------------
Anderson-Darling statistic            :    0.49
p-value of test                       :    0.51


-----------------------------------------------
CPU time used                    :  00:02:02.09

Generator state:




***********************************************************
HOST = DESKTOP-4M1PN36, Linux

pipe_gen


svaria_SampleProd test:
-----------------------------------------------
   N =  1,  n = 10000000,  r =  0,   t = 10


-----------------------------------------------
Anderson-Darling statistic            :    0.36
p-value of test                       :    0.64

-----------------------------------------------
CPU time used                    :  00:00:36.80

Generator state:




***********************************************************
HOST = DESKTOP-4M1PN36, Linux

pipe_gen


svaria_SampleProd test:
-----------------------------------------------
   N =  1,  n = 10000000,  r =  0,   t = 30


-----------------------------------------------
Anderson-Darling statistic            :    0.66
p-value of test                       :    0.34

-----------------------------------------------
CPU time used                    :  00:01:51.85

Generator state:




***********************************************************
HOST = DESKTOP-4M1PN36, Linux

pipe_gen


svaria_SampleMean test:
-----------------------------------------------
   N = 10000000,  n = 20,  r =  0


-----------------------------------------------

Kolmogorov-Smirnov+ statistic = D+    : 1.85e-4
p-value of test                       :    0.51

Kolmogorov-Smirnov- statistic = D-    : 1.35e-4
p-value of test                       :    0.69

Anderson-Darling statistic = A2       :    0.52
p-value of test                       :    0.73

-----------------------------------------------
CPU time used                    :  00:01:13.68

Generator state:




***********************************************************
HOST = DESKTOP-4M1PN36, Linux

pipe_gen


svaria_SampleCorr test:
-----------------------------------------------
   N =  1,  n = 500000000,  r =  0,   k = 1


-----------------------------------------------
Normal statistic                      :   -0.43
p-value of test                       :    0.67

-----------------------------------------------
CPU time used                    :  00:02:56.94

Generator state:




***********************************************************
HOST = DESKTOP-4M1PN36, Linux

pipe_gen


svaria_AppearanceSpacings test:
-----------------------------------------------
   N =  1,   Q = 10000000,   K = 400000000,   r = 0,   s = 30,   L = 15

   Sequences of n = (K + Q)L =   6150000000 bits
   Q = 10000000 initialization blocks
   K = 400000000 blocks for the test
   the blocks have L = 15 bits



-----------------------------------------------
Normal statistic                      :    0.53
p-value of test                       :    0.30

-----------------------------------------------
CPU time used                    :  00:01:27.35

Generator state:




***********************************************************
HOST = DESKTOP-4M1PN36, Linux

pipe_gen


svaria_AppearanceSpacings test:
-----------------------------------------------
   N =  1,   Q = 10000000,   K = 100000000,   r = 20,   s = 10,   L = 15

   Sequences of n = (K + Q)L =   1650000000 bits
   Q = 10000000 initialization blocks
   K = 100000000 blocks for the test
   the blocks have L = 15 bits



-----------------------------------------------
Normal statistic                      :   -1.24
p-value of test                       :    0.89

-----------------------------------------------
CPU time used                    :  00:01:27.31

Generator state:




***********************************************************
HOST = DESKTOP-4M1PN36, Linux

pipe_gen


svaria_WeightDistrib test:
-----------------------------------------------
   N =  1,  n = 2000000,  r =  0,  k = 256,  Alpha =      0,  Beta =  0.125


-----------------------------------------------
Number of degrees of freedom          :   46
Chi-square statistic                  :   66.97
p-value of test                       :    0.02

-----------------------------------------------
CPU time used                    :  00:03:17.50

Generator state:




***********************************************************
HOST = DESKTOP-4M1PN36, Linux

pipe_gen


svaria_WeightDistrib test:
-----------------------------------------------
   N =  1,  n = 2000000,  r =  8,  k = 256,  Alpha =      0,  Beta =  0.125


-----------------------------------------------
Number of degrees of freedom          :   46
Chi-square statistic                  :   93.89
p-value of test                       :  4.0e-5    *****

-----------------------------------------------
CPU time used                    :  00:03:25.79

Generator state:




***********************************************************
HOST = DESKTOP-4M1PN36, Linux

pipe_gen


svaria_WeightDistrib test:
-----------------------------------------------
   N =  1,  n = 2000000,  r = 16,  k = 256,  Alpha =      0,  Beta =  0.125


-----------------------------------------------
Number of degrees of freedom          :   46
Chi-square statistic                  :  101.06
p-value of test                       :  5.2e-6    *****

-----------------------------------------------
CPU time used                    :  00:03:21.39

Generator state:




***********************************************************
HOST = DESKTOP-4M1PN36, Linux

pipe_gen


svaria_WeightDistrib test:
-----------------------------------------------
   N =  1,  n = 2000000,  r = 24,  k = 256,  Alpha =      0,  Beta =  0.125


-----------------------------------------------
Number of degrees of freedom          :   46
Chi-square statistic                  :   75.58
p-value of test                       :  3.9e-3

-----------------------------------------------
CPU time used                    :  00:03:25.13

Generator state:




***********************************************************
HOST = DESKTOP-4M1PN36, Linux

pipe_gen


svaria_SumCollector test:
-----------------------------------------------
   N =  1,  n = 20000000,  r =  0,   g = 10


-----------------------------------------------
Number of degrees of freedom          :   25
Chi-square statistic                  :   35.64
p-value of test                       :    0.08

-----------------------------------------------
CPU time used                    :  00:02:41.79

Generator state:




***********************************************************
HOST = DESKTOP-4M1PN36, Linux

pipe_gen


smarsa_MatrixRank test:
-----------------------------------------------
   N =  1,  n = 1000000,  r =  0,    s = 30,    L = 60,    k = 60


-----------------------------------------------
Number of degrees of freedom          :    4
Chi-square statistic                  :    2.54
p-value of test                       :    0.64

-----------------------------------------------
CPU time used                    :  00:01:20.71

Generator state:




***********************************************************
HOST = DESKTOP-4M1PN36, Linux

pipe_gen


smarsa_MatrixRank test:
-----------------------------------------------
   N =  1,  n = 1000000,  r = 20,    s = 10,    L = 60,    k = 60


-----------------------------------------------
Number of degrees of freedom          :    4
Chi-square statistic                  :    8.21
p-value of test                       :    0.08

-----------------------------------------------
CPU time used                    :  00:02:50.84

Generator state:




***********************************************************
HOST = DESKTOP-4M1PN36, Linux

pipe_gen


smarsa_MatrixRank test:
-----------------------------------------------
   N =  1,  n = 50000,  r =  0,    s = 30,    L = 300,    k = 300


-----------------------------------------------
Number of degrees of freedom          :    3
Chi-square statistic                  :    2.24
p-value of test                       :    0.52

-----------------------------------------------
CPU time used                    :  00:01:32.54

Generator state:




***********************************************************
HOST = DESKTOP-4M1PN36, Linux

pipe_gen


smarsa_MatrixRank test:
-----------------------------------------------
   N =  1,  n = 50000,  r = 20,    s = 10,    L = 300,    k = 300


-----------------------------------------------
Number of degrees of freedom          :    3
Chi-square statistic                  :    6.54
p-value of test                       :    0.09

-----------------------------------------------
CPU time used                    :  00:03:39.21

Generator state:




***********************************************************
HOST = DESKTOP-4M1PN36, Linux

pipe_gen


smarsa_MatrixRank test:
-----------------------------------------------
   N =  1,  n = 2000,  r =  0,    s = 30,    L = 1200,    k = 1200


-----------------------------------------------
Number of degrees of freedom          :    3
Chi-square statistic                  :    3.04
p-value of test                       :    0.39

-----------------------------------------------
CPU time used                    :  00:01:06.07

Generator state:




***********************************************************
HOST = DESKTOP-4M1PN36, Linux

pipe_gen


smarsa_MatrixRank test:
-----------------------------------------------
   N =  1,  n = 2000,  r = 20,    s = 10,    L = 1200,    k = 1200


-----------------------------------------------
Number of degrees of freedom          :    3
Chi-square statistic                  :    0.94
p-value of test                       :    0.82

-----------------------------------------------
CPU time used                    :  00:02:22.56

Generator state:




***********************************************************
HOST = DESKTOP-4M1PN36, Linux

pipe_gen


smarsa_Savir2 test:
-----------------------------------------------
   N =  1,  n = 20000000,  r =  0,    m = 1048576,    t = 30


-----------------------------------------------
Number of degrees of freedom          :   17
Chi-square statistic                  :   13.55
p-value of test                       :    0.70

-----------------------------------------------
CPU time used                    :  00:03:15.80

Generator state:




***********************************************************
HOST = DESKTOP-4M1PN36, Linux

pipe_gen


smarsa_GCD test:
-----------------------------------------------
   N =  1,  n = 100000000,  r =  0,   s = 30


-----------------------------------------------
Number of degrees of freedom          : 2465
Chi2 statistic for GCD values         : 2463.94
p-value of test                       :    0.50



-----------------------------------------------
CPU time used                    :  00:01:22.26

Generator state:




***********************************************************
HOST = DESKTOP-4M1PN36, Linux

pipe_gen


smarsa_GCD test:
-----------------------------------------------
   N =  1,  n = 40000000,  r = 10,   s = 20


-----------------------------------------------
Number of degrees of freedom          : 1559
Chi2 statistic for GCD values         : 1612.00
p-value of test                       :    0.17



-----------------------------------------------
CPU time used                    :  00:00:30.87

Generator state:




***********************************************************
HOST = DESKTOP-4M1PN36, Linux

pipe_gen


swalk_RandomWalk1 test:
-----------------------------------------------
   N =  1,  n = 50000000,  r =  0,   s = 30,   L0 =   90,   L1 =   90



-----------------------------------------------
Test on the values of the Statistic H

Number of degrees of freedom          :   46
ChiSquare statistic                   :   49.86
p-value of test                       :    0.32


-----------------------------------------------
Test on the values of the Statistic M

Number of degrees of freedom          :   47
ChiSquare statistic                   :   67.56
p-value of test                       :    0.03


-----------------------------------------------
Test on the values of the Statistic J

Number of degrees of freedom          :   45
ChiSquare statistic                   :   52.60
p-value of test                       :    0.20


-----------------------------------------------
Test on the values of the Statistic R

Number of degrees of freedom          :   36
ChiSquare statistic                   :   39.21
p-value of test                       :    0.33


-----------------------------------------------
Test on the values of the Statistic C

Number of degrees of freedom          :   23
ChiSquare statistic                   :   11.77
p-value of test                       :    0.97


-----------------------------------------------
CPU time used                    :  00:01:17.50

Generator state:




***********************************************************
HOST = DESKTOP-4M1PN36, Linux

pipe_gen


swalk_RandomWalk1 test:
-----------------------------------------------
   N =  1,  n = 10000000,  r = 20,   s = 10,   L0 =   90,   L1 =   90



-----------------------------------------------
Test on the values of the Statistic H

Number of degrees of freedom          :   44
ChiSquare statistic                   :   53.33
p-value of test                       :    0.16


-----------------------------------------------
Test on the values of the Statistic M

Number of degrees of freedom          :   45
ChiSquare statistic                   :   40.63
p-value of test                       :    0.66


-----------------------------------------------
Test on the values of the Statistic J

Number of degrees of freedom          :   45
ChiSquare statistic                   :   40.13
p-value of test                       :    0.68


-----------------------------------------------
Test on the values of the Statistic R

Number of degrees of freedom          :   35
ChiSquare statistic                   :   38.69
p-value of test                       :    0.31


-----------------------------------------------
Test on the values of the Statistic C

Number of degrees of freedom          :   22
ChiSquare statistic                   :   29.25
p-value of test                       :    0.14


-----------------------------------------------
CPU time used                    :  00:00:37.37

Generator state:




***********************************************************
HOST = DESKTOP-4M1PN36, Linux

pipe_gen


swalk_RandomWalk1 test:
-----------------------------------------------
   N =  1,  n = 5000000,  r =  0,   s = 30,   L0 = 1000,   L1 = 1000



-----------------------------------------------
Test on the values of the Statistic H

Number of degrees of freedom          :  140
ChiSquare statistic                   :  119.77
p-value of test                       :    0.89


-----------------------------------------------
Test on the values of the Statistic M

Number of degrees of freedom          :  141
ChiSquare statistic                   :  130.44
p-value of test                       :    0.73


-----------------------------------------------
Test on the values of the Statistic J

Number of degrees of freedom          :  500
ChiSquare statistic                   :  471.35
p-value of test                       :    0.82


-----------------------------------------------
Test on the values of the Statistic R

Number of degrees of freedom          :  132
ChiSquare statistic                   :  102.13
p-value of test                       :    0.97


-----------------------------------------------
Test on the values of the Statistic C

Number of degrees of freedom          :   72
ChiSquare statistic                   :   67.90
p-value of test                       :    0.61


-----------------------------------------------
CPU time used                    :  00:01:19.04

Generator state:




***********************************************************
HOST = DESKTOP-4M1PN36, Linux

pipe_gen


swalk_RandomWalk1 test:
-----------------------------------------------
   N =  1,  n = 1000000,  r = 20,   s = 10,   L0 = 1000,   L1 = 1000



-----------------------------------------------
Test on the values of the Statistic H

Number of degrees of freedom          :  128
ChiSquare statistic                   :  121.28
p-value of test                       :    0.65


-----------------------------------------------
Test on the values of the Statistic M

Number of degrees of freedom          :  130
ChiSquare statistic                   :  152.45
p-value of test                       :    0.09


-----------------------------------------------
Test on the values of the Statistic J

Number of degrees of freedom          :  500
ChiSquare statistic                   :  534.00
p-value of test                       :    0.14


-----------------------------------------------
Test on the values of the Statistic R

Number of degrees of freedom          :  122
ChiSquare statistic                   :  139.70
p-value of test                       :    0.13


-----------------------------------------------
Test on the values of the Statistic C

Number of degrees of freedom          :   66
ChiSquare statistic                   :   71.90
p-value of test                       :    0.29


-----------------------------------------------
CPU time used                    :  00:00:39.05

Generator state:




***********************************************************
HOST = DESKTOP-4M1PN36, Linux

pipe_gen


swalk_RandomWalk1 test:
-----------------------------------------------
   N =  1,  n = 500000,  r =  0,   s = 30,   L0 = 10000,   L1 = 10000



-----------------------------------------------
Test on the values of the Statistic H

Number of degrees of freedom          :  366
ChiSquare statistic                   :  333.25
p-value of test                       :    0.89


-----------------------------------------------
Test on the values of the Statistic M

Number of degrees of freedom          :  366
ChiSquare statistic                   :  347.40
p-value of test                       :    0.75


-----------------------------------------------
Test on the values of the Statistic J

Number of degrees of freedom          : 5000
ChiSquare statistic                   : 5058.58
p-value of test                       :    0.28


-----------------------------------------------
Test on the values of the Statistic R

Number of degrees of freedom          :  360
ChiSquare statistic                   :  450.97
p-value of test                       :  7.8e-4    *****


-----------------------------------------------
Test on the values of the Statistic C

Number of degrees of freedom          :  192
ChiSquare statistic                   :  184.80
p-value of test                       :    0.63


-----------------------------------------------
CPU time used                    :  00:01:14.62

Generator state:




***********************************************************
HOST = DESKTOP-4M1PN36, Linux

pipe_gen


swalk_RandomWalk1 test:
-----------------------------------------------
   N =  1,  n = 100000,  r = 20,   s = 10,   L0 = 10000,   L1 = 10000



-----------------------------------------------
Test on the values of the Statistic H

Number of degrees of freedom          :  318
ChiSquare statistic                   :  305.19
p-value of test                       :    0.69


-----------------------------------------------
Test on the values of the Statistic M

Number of degrees of freedom          :  318
ChiSquare statistic                   :  302.99
p-value of test                       :    0.72


-----------------------------------------------
Test on the values of the Statistic J

Number of degrees of freedom          : 5000
ChiSquare statistic                   : 5004.44
p-value of test                       :    0.48


-----------------------------------------------
Test on the values of the Statistic R

Number of degrees of freedom          :  315
ChiSquare statistic                   :  323.97
p-value of test                       :    0.35


-----------------------------------------------
Test on the values of the Statistic C

Number of degrees of freedom          :  169
ChiSquare statistic                   :  153.33
p-value of test                       :    0.80


-----------------------------------------------
CPU time used                    :  00:00:38.54

Generator state:




***********************************************************
HOST = DESKTOP-4M1PN36, Linux

pipe_gen


scomp_LinearComp test:
-----------------------------------------------
   N =  1,  n = 120000,  r =  0,    s = 1



-----------------------------------------------
Number of degrees of freedom          :   10
Chi2 statistic for size of jumps      :   12.36
p-value of test                       :    0.26


-----------------------------------------------
Normal statistic for number of jumps  :   -2.28
p-value of test                       :    0.99



-----------------------------------------------
CPU time used                    :  00:00:09.75

Generator state:




***********************************************************
HOST = DESKTOP-4M1PN36, Linux

pipe_gen


scomp_LinearComp test:
-----------------------------------------------
   N =  1,  n = 120000,  r = 29,    s = 1



-----------------------------------------------
Number of degrees of freedom          :   10
Chi2 statistic for size of jumps      :    6.39
p-value of test                       :    0.78


-----------------------------------------------
Normal statistic for number of jumps  :   -1.01
p-value of test                       :    0.84



-----------------------------------------------
CPU time used                    :  00:00:09.65

Generator state:




***********************************************************
HOST = DESKTOP-4M1PN36, Linux

pipe_gen


scomp_LempelZiv test:
-----------------------------------------------
   N = 10,  n = 33554432,  r =  0,   s =   30,   k =   25


-----------------------------------------------

Kolmogorov-Smirnov+ statistic = D+    :   0.076
p-value of test                       :    0.85

Kolmogorov-Smirnov- statistic = D-    :    0.28
p-value of test                       :    0.17

Anderson-Darling statistic = A2       :    1.20
p-value of test                       :    0.27

Tests on the sum of all N observations
Standardized normal statistic         :    1.21
p-value of test                       :    0.11

Sample variance                       :    0.55
p-value of test                       :    0.84

-----------------------------------------------
CPU time used                    :  00:00:30.39

Generator state:




***********************************************************
HOST = DESKTOP-4M1PN36, Linux

pipe_gen


sspectral_Fourier3 test:
-----------------------------------------------
   N = 50000,  n = 16384,  r =  0,   s =   30,   k =   14


-----------------------------------------------

Kolmogorov-Smirnov+ statistic = D+    : 6.14e-3
p-value of test                       :    0.73

Kolmogorov-Smirnov- statistic = D-    : 8.28e-3
p-value of test                       :    0.57

Anderson-Darling statistic = A2       :    0.29
p-value of test                       :    0.94

-----------------------------------------------
CPU time used                    :  00:00:21.70

Generator state:




***********************************************************
HOST = DESKTOP-4M1PN36, Linux

pipe_gen


sspectral_Fourier3 test:
-----------------------------------------------
   N = 50000,  n = 16384,  r = 20,   s =   10,   k =   14


-----------------------------------------------

Kolmogorov-Smirnov+ statistic = D+    : 8.71e-3
p-value of test                       :    0.53

Kolmogorov-Smirnov- statistic = D-    :   0.012
p-value of test                       :    0.34

Anderson-Darling statistic = A2       :    0.40
p-value of test                       :    0.85

-----------------------------------------------
CPU time used                    :  00:00:40.80

Generator state:




***********************************************************
HOST = DESKTOP-4M1PN36, Linux

pipe_gen


sstring_LongestHeadRun test:
-----------------------------------------------
   N =  1,  n = 1000,  r =  0,   s = 30,   L = 10000020


-----------------------------------------------
Number of degrees of freedom          :    8
Chi-square statistic                  :    4.55
p-value of test                       :    0.80

-----------------------------------------------
Global longest run of 1               :   30.00
p-value of test                       :    0.90



-----------------------------------------------
CPU time used                    :  00:02:51.12

Generator state:




***********************************************************
HOST = DESKTOP-4M1PN36, Linux

pipe_gen


sstring_LongestHeadRun test:
-----------------------------------------------
   N =  1,  n = 300,  r = 20,   s = 10,   L = 10000020


-----------------------------------------------
Number of degrees of freedom          :    7
Chi-square statistic                  :    4.06
p-value of test                       :    0.77

-----------------------------------------------
Global longest run of 1               :   32.00
p-value of test                       :    0.29



-----------------------------------------------
CPU time used                    :  00:02:01.45

Generator state:




***********************************************************
HOST = DESKTOP-4M1PN36, Linux

pipe_gen


sstring_PeriodsInStrings test:
-----------------------------------------------
   N =  1,  n = 300000000,  r =  0,   s =   30


-----------------------------------------------
Number of degrees of freedom          :  302
Chi-square statistic                  :  310.80
p-value of test                       :    0.35

-----------------------------------------------
CPU time used                    :  00:01:57.80

Generator state:




***********************************************************
HOST = DESKTOP-4M1PN36, Linux

pipe_gen


sstring_PeriodsInStrings test:
-----------------------------------------------
   N =  1,  n = 300000000,  r = 15,   s =   15


-----------------------------------------------
Number of degrees of freedom          :   56
Chi-square statistic                  :   39.62
p-value of test                       :    0.95

-----------------------------------------------
CPU time used                    :  00:01:55.86

Generator state:




***********************************************************
HOST = DESKTOP-4M1PN36, Linux

pipe_gen


sstring_HammingWeight2 test:
-----------------------------------------------
   N = 100,  n = 100000000,  r =  0,   s = 30,   L = 1000000


-----------------------------------------------

Kolmogorov-Smirnov+ statistic = D+    :    0.11
p-value of test                       :    0.08

Kolmogorov-Smirnov- statistic = D-    :   0.024
p-value of test                       :    0.87

Anderson-Darling statistic = A2       :    1.31
p-value of test                       :    0.23

Test on the sum of all N observations
Number of degrees of freedom          : 10000
Chi-square statistic                  : 9786.99
p-value of test                       :    0.93

-----------------------------------------------
CPU time used                    :  00:02:02.48

Generator state:




***********************************************************
HOST = DESKTOP-4M1PN36, Linux

pipe_gen


sstring_HammingWeight2 test:
-----------------------------------------------
   N = 30,  n = 100000000,  r = 20,   s = 10,   L = 1000000


-----------------------------------------------

Kolmogorov-Smirnov+ statistic = D+    :    0.26
p-value of test                       :    0.01

Kolmogorov-Smirnov- statistic = D-    : 4.10e-3
p-value of test                       :    0.9954

Anderson-Darling statistic = A2       :    2.97
p-value of test                       :    0.03

Test on the sum of all N observations
Number of degrees of freedom          : 3000
Chi-square statistic                  : 2810.01
p-value of test                       :    0.9938

-----------------------------------------------
CPU time used                    :  00:01:46.39

Generator state:




***********************************************************
HOST = DESKTOP-4M1PN36, Linux

pipe_gen


sstring_HammingCorr test:
-----------------------------------------------
   N =  1,  n = 500000000,  r =  0,   s = 30,   L = 30



-----------------------------------------------
Normal statistic                      :    0.27
p-value of test                       :    0.40

-----------------------------------------------
CPU time used                    :  00:03:03.84

Generator state:




***********************************************************
HOST = DESKTOP-4M1PN36, Linux

pipe_gen


sstring_HammingCorr test:
-----------------------------------------------
   N =  1,  n = 50000000,  r =  0,   s = 30,   L = 300



-----------------------------------------------
Normal statistic                      :   -1.55
p-value of test                       :    0.94

-----------------------------------------------
CPU time used                    :  00:02:59.04

Generator state:




***********************************************************
HOST = DESKTOP-4M1PN36, Linux

pipe_gen


sstring_HammingCorr test:
-----------------------------------------------
   N =  1,  n = 10000000,  r =  0,   s = 30,   L = 1200



-----------------------------------------------
Normal statistic                      :   -0.11
p-value of test                       :    0.54

-----------------------------------------------
CPU time used                    :  00:02:21.20

Generator state:




***********************************************************
HOST = DESKTOP-4M1PN36, Linux

pipe_gen


sstring_HammingIndep test:
-----------------------------------------------
   N =  1,  n = 300000000,  r =  0,   s = 30,   L = 30,   d = 0



Counters with expected numbers >= 10
-----------------------------------------------
Number of degrees of freedom          :  577
Chi-square statistic                  :  900.66
p-value of test                       : 1.1e-16    *****

-----------------------------------------------
CPU time used                    :  00:03:37.61

Generator state:




***********************************************************
HOST = DESKTOP-4M1PN36, Linux

pipe_gen


sstring_HammingIndep test:
-----------------------------------------------
   N =  1,  n = 100000000,  r = 20,   s = 10,   L = 30,   d = 0



Counters with expected numbers >= 10
-----------------------------------------------
Number of degrees of freedom          :  533
Chi-square statistic                  :  524.86
p-value of test                       :    0.59

-----------------------------------------------
CPU time used                    :  00:03:31.36

Generator state:




***********************************************************
HOST = DESKTOP-4M1PN36, Linux

pipe_gen


sstring_HammingIndep test:
-----------------------------------------------
   N =  1,  n = 30000000,  r =  0,   s = 30,   L = 300,   d = 0



Counters with expected numbers >= 10
-----------------------------------------------
Number of degrees of freedom          : 4117
Chi-square statistic                  : 4024.55
p-value of test                       :    0.85

-----------------------------------------------
CPU time used                    :  00:03:33.86

Generator state:




***********************************************************
HOST = DESKTOP-4M1PN36, Linux

pipe_gen


sstring_HammingIndep test:
-----------------------------------------------
   N =  1,  n = 10000000,  r = 20,   s = 10,   L = 300,   d = 0



Counters with expected numbers >= 10
-----------------------------------------------
Number of degrees of freedom          : 3585
Chi-square statistic                  : 3746.05
p-value of test                       :    0.03

-----------------------------------------------
CPU time used                    :  00:03:29.48

Generator state:




***********************************************************
HOST = DESKTOP-4M1PN36, Linux

pipe_gen


sstring_HammingIndep test:
-----------------------------------------------
   N =  1,  n = 10000000,  r =  0,   s = 30,   L = 1200,   d = 0



Counters with expected numbers >= 10
-----------------------------------------------
Number of degrees of freedom          : 11825
Chi-square statistic                  :12183.45
p-value of test                       :    0.01

-----------------------------------------------
CPU time used                    :  00:04:45.69

Generator state:




***********************************************************
HOST = DESKTOP-4M1PN36, Linux

pipe_gen


sstring_HammingIndep test:
-----------------------------------------------
   N =  1,  n = 1000000,  r = 20,   s = 10,   L = 1200,   d = 0



Counters with expected numbers >= 10
-----------------------------------------------
Number of degrees of freedom          : 7473
Chi-square statistic                  : 7324.77
p-value of test                       :    0.89

-----------------------------------------------
CPU time used                    :  00:01:25.34

Generator state:




***********************************************************
HOST = DESKTOP-4M1PN36, Linux

pipe_gen


sstring_Run test:
-----------------------------------------------
   N =  1,  n = 1000000000,  r =  0,   s =   30


-----------------------------------------------
Total number of 1 runs:  1000000001

Number of degrees of freedom          :   52
Chi2 statistic for number of runs     :   51.60
p-value of test                       :    0.49


-----------------------------------------------
Total number of bits:  3999975090

Normal statistic for number of bits   :   -0.28
p-value of test                       :    0.61



-----------------------------------------------
CPU time used                    :  00:01:10.94

Generator state:




***********************************************************
HOST = DESKTOP-4M1PN36, Linux

pipe_gen


sstring_Run test:
-----------------------------------------------
   N =  1,  n = 1000000000,  r = 20,   s =   10


-----------------------------------------------
Total number of 1 runs:  1000000000

Number of degrees of freedom          :   52
Chi2 statistic for number of runs     :   45.95
p-value of test                       :    0.71


-----------------------------------------------
Total number of bits:  3999944070

Normal statistic for number of bits   :   -0.63
p-value of test                       :    0.73



-----------------------------------------------
CPU time used                    :  00:02:46.14

Generator state:




***********************************************************
HOST = DESKTOP-4M1PN36, Linux

pipe_gen


sstring_AutoCor test:
-----------------------------------------------
   N = 10,  n = 1000000021,  r =  0,   s = 30,   d = 1


-----------------------------------------------

Kolmogorov-Smirnov+ statistic = D+    :    0.18
p-value of test                       :    0.46

Kolmogorov-Smirnov- statistic = D-    :    0.17
p-value of test                       :    0.50

Anderson-Darling statistic = A2       :    0.48
p-value of test                       :    0.76

Tests on the sum of all N observations
Standardized normal statistic         :    0.35
p-value of test                       :    0.36

Sample variance                       :    1.20
p-value of test                       :    0.29

-----------------------------------------------
CPU time used                    :  00:02:07.75

Generator state:




***********************************************************
HOST = DESKTOP-4M1PN36, Linux

pipe_gen


sstring_AutoCor test:
-----------------------------------------------
   N =  5,  n = 1000000001,  r = 20,   s = 10,   d = 1


-----------------------------------------------

Kolmogorov-Smirnov+ statistic = D+    :    0.18
p-value of test                       :    0.65

Kolmogorov-Smirnov- statistic = D-    :    0.41
p-value of test                       :    0.14

Anderson-Darling statistic = A2       :    1.06
p-value of test                       :    0.33

Tests on the sum of all N observations
Standardized normal statistic         :    0.90
p-value of test                       :    0.18

Sample variance                       :    0.33
p-value of test                       :    0.86

-----------------------------------------------
CPU time used                    :  00:03:06.02

Generator state:




***********************************************************
HOST = DESKTOP-4M1PN36, Linux

pipe_gen


sstring_AutoCor test:
-----------------------------------------------
   N = 10,  n = 1000000020,  r =  0,   s = 30,   d = 30


-----------------------------------------------

Kolmogorov-Smirnov+ statistic = D+    :   0.089
p-value of test                       :    0.81

Kolmogorov-Smirnov- statistic = D-    :    0.33
p-value of test                       :    0.09

Anderson-Darling statistic = A2       :    1.29
p-value of test                       :    0.24

Tests on the sum of all N observations
Standardized normal statistic         :    1.03
p-value of test                       :    0.15

Sample variance                       :    1.51
p-value of test                       :    0.14

-----------------------------------------------
CPU time used                    :  00:02:04.21

Generator state:




***********************************************************
HOST = DESKTOP-4M1PN36, Linux

pipe_gen


sstring_AutoCor test:
-----------------------------------------------
   N =  5,  n = 1000000010,  r = 20,   s = 10,   d = 10


-----------------------------------------------

Kolmogorov-Smirnov+ statistic = D+    :    0.36
p-value of test                       :    0.21

Kolmogorov-Smirnov- statistic = D-    :    0.41
p-value of test                       :    0.14

Anderson-Darling statistic = A2       :    1.11
p-value of test                       :    0.30

Tests on the sum of all N observations
Standardized normal statistic         :    0.16
p-value of test                       :    0.44

Sample variance                       :   0.068
p-value of test                       :    0.9914

-----------------------------------------------
CPU time used                    :  00:03:00.87

Generator state:





========= Summary results of Crush =========

 Version:          TestU01 1.2.3
 Generator:        pipe_gen
 Number of statistics:  144
 Total CPU time:   03:54:32.89
 The following tests gave p-values outside [0.001, 0.9990]:
 (eps  means a value < 1.0e-300):
 (eps1 means a value < 1.0e-15):

       Test                          p-value
 ----------------------------------------------
 24  SimpPoker, d = 16               1.6e-5
 31  Gap, r = 0                     1.6e-15
 32  Gap, r = 27                     4.8e-6
 33  Gap, r = 0                       eps  
 34  Gap, r = 22                      eps  
 52  WeightDistrib, r = 8            4.0e-5
 53  WeightDistrib, r = 16           5.2e-6
 69  RandomWalk1 R (L = 10000)       7.8e-4
 85  HammingIndep, L = 30           1.1e-16
 ----------------------------------------------
 All other tests were passed



